{
  "schema_version": 1,
  "id": "keil.clean",
  "title": "清理构建产物",
  "description": "安全删除当前target的输出、列表和工具日志。",
  "category": "维护",
  "icon": "Trash2",
  "order": 80,
  "availability": "active",
  "parameter_mode": "none",
  "entrypoint": {"kind": "builtin", "handler": "clean"},
  "check": {"handler": "project", "timeout_ms": 5000},
  "progress": {"mode": "event"},
  "inputs": [],
  "validators": ["clean_complete"],
  "resources": ["keil:${project}"],
  "danger": "safe",
  "cancellable": true,
  "quick": true
}
