{
  "schema_version": 1,
  "id": "test.demo_progress",
  "title": "测试进度任务",
  "description": "仅在ARK_STUDIO_TEST_MODE=1时加载，用于验证动态发现和实时事件。",
  "category": "测试",
  "icon": "FlaskConical",
  "order": 999,
  "availability": "active",
  "parameter_mode": "none",
  "entrypoint": {"kind": "builtin", "handler": "demo_progress"},
  "check": {"handler": "always", "timeout_ms": 1000},
  "progress": {"mode": "event"},
  "inputs": [],
  "validators": [],
  "resources": [],
  "danger": "safe",
  "cancellable": true,
  "quick": true,
  "test_only": true
}
